{"admission":{"boundary_tolerance_ns":5000000000,"maximum_event_receive_delta_ns":5000000000,"minimum_depth_messages_per_symbol":2,"minimum_trade_messages_per_symbol":2,"require_72h_pilot":true,"require_capture_complete":true,"require_live_origin":true,"require_whole_utc_day":true},"allowed_data_origins":["live_binance","synthetic_transport_fixture"],"crossed_or_locked_books_allowed":false,"negative_or_nonfinite_values_allowed":false,"primary_historical_study_repairs_missing_events":false,"research_specification_changed":false,"schema_version":1,"symbols":["BTCUSDT","ETHUSDT"],"venue_id":"binance_spot"}
